{
  "$schema": "./project-watcher.schema.json",
  "paths": [
    "~/Projects"
  ],
  "maxDepth": 6,
  "outputDir": "reports",
  "excludeDirs": [
    ".git",
    "__pycache__",
    ".env",
    ".mypy_cache",
    ".pytest_cache",
    ".ruff_cache",
    ".asc",
    ".tmp",
    ".venv",
    ".venv-placeholders",
    "node_modules",
    "dist",
    "build",
    "coverage",
    ".next",
    ".playwright",
    ".turbo",
    ".cache",
    ".build",
    "DerivedData",
    "dSYMs",
    "env",
    "playwright-profiles",
    "site-packages",
    "target",
    "tmp",
    "venv",
    "vendor"
  ],
  "excludeFiles": [
    ".DS_Store",
    ".env",
    "package-lock.json",
    "pnpm-lock.yaml",
    "yarn.lock",
    "Cargo.lock",
    "Gemfile.lock"
  ],
  "maxFileBytes": 1048576,
  "locTool": "auto",
  "countDuplicateFiles": false,
  "fileScope": "tracked",
  "maxSnapshots": 52,
  "sections": [
    "quick-links",
    "release-activity",
    "release-gaps",
    "release-readiness",
    "since-previous-scan",
    "weekly-commits",
    "weekly-churn",
    "contributors",
    "release-coverage",
    "active-this-week",
    "weekly-totals",
    "loc-trend",
    "thirty-day-commits",
    "languages",
    "file-types",
    "most-active-repositories",
    "attention",
    "repository-table",
    "roots",
    "csv-exports",
    "ai-agents",
    "agent-coverage"
  ],
  "releaseReadiness": {
    "watchAfterDays": 3,
    "releaseDueAfterDays": 7,
    "staleAfterDays": 90
  }
}
